<?xml version="1.0" encoding="ISO-8859-2"?>
<flags xmlns="http://swmud.pl/ns/swaedit/flags"
	xmlns:xsi="http://www.w3.org/2001/XMLSchema-instance"
	xsi:schemaLocation="http://swmud.pl/ns/swaedit/flags src/flags.xsd ">
	<flag>
		<name>take</name>
		<value>1</value>
	</flag>
	<flag>
		<name>finger</name>
		<value>2</value>
	</flag>
	<flag>
		<name>neck</name>
		<value>4</value>
	</flag>
	<flag>
		<name>body</name>
		<value>8</value>
	</flag>
	<flag>
		<name>head</name>
		<value>16</value>
	</flag>
	<flag>
		<name>legs</name>
		<value>32</value>
	</flag>
	<flag>
		<name>feet</name>
		<value>64</value>
	</flag>
	<flag>
		<name>hands</name>
		<value>128</value>
	</flag>
	<flag>
		<name>arms</name>
		<value>256</value>
	</flag>
	<flag>
		<name>shield</name>
		<value>512</value>
	</flag>
	<flag>
		<name>about</name>
		<value>1024</value>
	</flag>
	<flag>
		<name>waist</name>
		<value>2048</value>
	</flag>
	<flag>
		<name>wrist</name>
		<value>4096</value>
	</flag>
	<flag>
		<name>wield</name>
		<value>8192</value>
	</flag>
	<flag>
		<name>hold</name>
		<value>16384</value>
	</flag>
	<flag>
		<name>dual_wield</name>
		<value>32768</value>
	</flag>
	<flag>
		<name>ears</name>
		<value>65536</value>
	</flag>
	<flag>
		<name>eyes</name>
		<value>131072</value>
	</flag>
	<flag>
		<name>missile_wield</name>
		<value>262144</value>
	</flag>
</flags>
