<?xml version="1.0" encoding="ISO-8859-2"?>
<flags xmlns="http://swmud.pl/ns/swaedit/flags"
	xmlns:xsi="http://www.w3.org/2001/XMLSchema-instance"
	xsi:schemaLocation="http://swmud.pl/ns/swaedit/flags src/flags.xsd ">
	<flag>
	    <name>fire</name>
	    <value>1</value>
	</flag>
	<flag>
	    <name>cold</name>
	    <value>2</value>
	</flag>
	<flag>
	    <name>electricity</name>
	    <value>4</value>
	</flag>
	<flag>
	    <name>energy</name>
	    <value>8</value>
	</flag>
	<flag>
	    <name>blunt</name>
	    <value>16</value>
	</flag>
	<flag>
	    <name>pierce</name>
	    <value>32</value>
	</flag>
	<flag>
	    <name>slash</name>
	    <value>64</value>
	</flag>
	<flag>
	    <name>acid</name>
	    <value>128</value>
	</flag>
	<flag>
	    <name>poison</name>
	    <value>256</value>
	</flag>
	<flag>
	    <name>drain</name>
	    <value>512</value>
	</flag>
	<flag>
	    <name>sleep</name>
	    <value>1024</value>
	</flag>
	<flag>
	    <name>charm</name>
	    <value>2048</value>
	</flag>
	<flag>
	    <name>hold</name>
	    <value>4096</value>
	</flag>
	<flag>
	    <name>nonforce</name>
	    <value>8192</value>
	</flag>
	<flag>
	    <name>plus1</name>
	    <value>16384</value>
	</flag>
	<flag>
	    <name>plus2</name>
	    <value>32768</value>
	</flag>
	<flag>
	    <name>plus3</name>
	    <value>65536</value>
	</flag>
	<flag>
	    <name>plus4</name>
	    <value>131072</value>
	</flag>
	<flag>
	    <name>plus5</name>
	    <value>262144</value>
	</flag>
	<flag>
	    <name>plus6</name>
	    <value>524288</value>
	</flag>
	<flag>
	    <name>force</name>
	    <value>1048576</value>
	</flag>
	<flag>
	    <name>paralysis</name>
	    <value>2097152</value>
	</flag>
</flags>
