<?xml version="1.0" encoding="UTF-8"?>
<flags xmlns="http://swmud.pl/ns/swaedit/flags"
	xmlns:xsi="http://www.w3.org/2001/XMLSchema-instance"
	xsi:schemaLocation="http://swmud.pl/ns/swaedit/flags src/flags.xsd ">
	<flag>
	    <name>parry</name>
	    <value>1</value>
	</flag>
	<flag>
	    <name>dodge</name>
	    <value>2</value>
	</flag>
	<flag>
	    <name>heal</name>
	    <value>4</value>
	</flag>
	<flag>
	    <name>curelight</name>
	    <value>8</value>
	</flag>
	<flag>
	    <name>cureserious</name>
	    <value>16</value>
	</flag>
	<flag>
	    <name>curecritical</name>
	    <value>32</value>
	</flag>
	<flag>
	    <name>dispelforce</name>
	    <value>64</value>
	</flag>
	<flag>
	    <name>dispelevil</name>
	    <value>128</value>
	</flag>
	<flag>
	    <name>sanctuary</name>
	    <value>256</value>
	</flag>
	<flag>
	    <name>fireshield</name>
	    <value>512</value>
	</flag>
	<flag>
	    <name>shockshield</name>
	    <value>1024</value>
	</flag>
	<flag>
	    <name>shield</name>
	    <value>2048</value>
	</flag>
	<flag>
	    <name>bless</name>
	    <value>4096</value>
	</flag>
	<flag>
	    <name>stoneskin</name>
	    <value>8192</value>
	</flag>
	<flag>
	    <name>teleport</name>
	    <value>16384</value>
	</flag>
	<flag>
	    <name>monsum1</name>
	    <value>32768</value>
	</flag>
	<flag>
	    <name>monsum2</name>
	    <value>65536</value>
	</flag>
	<flag>
	    <name>monsum3</name>
	    <value>131072</value>
	</flag>
	<flag>
	    <name>monsum4</name>
	    <value>262144</value>
	</flag>
	<flag>
	    <name>disarm</name>
	    <value>524288</value>
	</flag>
	<flag>
	    <name>iceshield</name>
	    <value>1048576</value>
	</flag>
	<flag>
	    <name>grip</name>
	    <value>2097152</value>
	</flag>
</flags>
