<?xml version="1.0" encoding="ISO-8859-2"?>
<flags xmlns="http://swmud.pl/ns/swaedit/flags"
	xmlns:xsi="http://www.w3.org/2001/XMLSchema-instance"
	xsi:schemaLocation="http://swmud.pl/ns/swaedit/flags src/flags.xsd ">
	<flag>
	    <name>head</name>
	    <value>1</value>
	</flag>
	<flag>
	    <name>arms</name>
	    <value>2</value>
	</flag>
	<flag>
	    <name>legs</name>
	    <value>4</value>
	</flag>
	<flag>
	    <name>heart</name>
	    <value>8</value>
	</flag>
	<flag>
	    <name>brains</name>
	    <value>16</value>
	</flag>
	<flag>
	    <name>guts</name>
	    <value>32</value>
	</flag>
	<flag>
	    <name>hands</name>
	    <value>64</value>
	</flag>
	<flag>
	    <name>feet</name>
	    <value>128</value>
	</flag>
	<flag>
	    <name>fingers</name>
	    <value>256</value>
	</flag>
	<flag>
	    <name>ear</name>
	    <value>512</value>
	</flag>
	<flag>
	    <name>eye</name>
	    <value>1024</value>
	</flag>
	<flag>
	    <name>long_tongue</name>
	    <value>2048</value>
	</flag>
	<flag>
	    <name>eyestalks</name>
	    <value>4096</value>
	</flag>
	<flag>
	    <name>tentacles</name>
	    <value>8192</value>
	</flag>
	<flag>
	    <name>fins</name>
	    <value>16384</value>
	</flag>
	<flag>
	    <name>wings</name>
	    <value>32768</value>
	</flag>
	<flag>
	    <name>tail</name>
	    <value>65536</value>
	</flag>
	<flag>
	    <name>leku</name>
	    <value>131072</value>
	</flag>
	<flag>
	    <name>claws</name>
	    <value>134217728</value>
	</flag>
	<flag>
	    <name>fangs</name>
	    <value>268435456</value>
	</flag>
	<flag>
	    <name>horns</name>
	    <value>536870912</value>
	</flag>
	<flag>
	    <name>scales</name>
	    <value>1073741824</value>
	</flag>
	<flag>
	    <name>tusks</name>
	    <value>2147483648</value>
	</flag>
</flags>
