<?xml version="1.0" encoding="ISO-8859-2"?>
<flags xmlns="http://swmud.pl/ns/swaedit/flags"
	xmlns:xsi="http://www.w3.org/2001/XMLSchema-instance"
	xsi:schemaLocation="http://swmud.pl/ns/swaedit/flags src/flags.xsd ">
	<flag>
	    <name>bite</name>
	    <value>1</value>
	</flag>
	<flag>
	    <name>claws</name>
	    <value>2</value>
	</flag>
	<flag>
	    <name>tail</name>
	    <value>4</value>
	</flag>
	<flag>
	    <name>sting</name>
	    <value>8</value>
	</flag>
	<flag>
	    <name>punch</name>
	    <value>16</value>
	</flag>
	<flag>
	    <name>kick</name>
	    <value>32</value>
	</flag>
	<flag>
	    <name>trip</name>
	    <value>64</value>
	</flag>
	<flag>
	    <name>bash</name>
	    <value>128</value>
	</flag>
	<flag>
	    <name>stun</name>
	    <value>256</value>
	</flag>
	<flag>
	    <name>gouge</name>
	    <value>512</value>
	</flag>
	<flag>
	    <name>backstab</name>
	    <value>1024</value>
	</flag>
	<flag>
	    <name>feed</name>
	    <value>2048</value>
	</flag>
	<flag>
	    <name>drain</name>
	    <value>4096</value>
	</flag>
	<flag>
	    <name>firebreath</name>
	    <value>8192</value>
	</flag>
	<flag>
	    <name>frostbreath</name>
	    <value>16384</value>
	</flag>
	<flag>
	    <name>acidbreath</name>
	    <value>32768</value>
	</flag>
	<flag>
	    <name>lightnbreath</name>
	    <value>65536</value>
	</flag>
	<flag>
	    <name>gasbreath</name>
	    <value>131072</value>
	</flag>
	<flag>
	    <name>poison</name>
	    <value>262144</value>
	</flag>
	<flag>
	    <name>nastypoison</name>
	    <value>524288</value>
	</flag>
	<flag>
	    <name>gaze</name>
	    <value>1048576</value>
	</flag>
	<flag>
	    <name>blindness</name>
	    <value>2097152</value>
	</flag>
	<flag>
	    <name>causeserious</name>
	    <value>4194304</value>
	</flag>
	<flag>
	    <name>earthquake</name>
	    <value>8388608</value>
	</flag>
	<flag>
	    <name>causecritical</name>
	    <value>16777216</value>
	</flag>
	<flag>
	    <name>curse</name>
	    <value>33554432</value>
	</flag>
	<flag>
	    <name>flamestrike</name>
	    <value>67108864</value>
	</flag>
	<flag>
	    <name>harm</name>
	    <value>134217728</value>
	</flag>
	<flag>
	    <name>fireball</name>
	    <value>268435456</value>
	</flag>
	<flag>
	    <name>colorspray</name>
	    <value>536870912</value>
	</flag>
	<flag>
	    <name>weaken</name>
	    <value>1073741824</value>
	</flag>
	<flag>
	    <name>spiralblast</name>
	    <value>2147483648</value>
	</flag>
</flags>
