<?xml version="1.0" encoding="ISO-8859-2"?>
<flags xmlns="http://swmud.pl/ns/swaedit/flags"
	xmlns:xsi="http://www.w3.org/2001/XMLSchema-instance"
	xsi:schemaLocation="http://swmud.pl/ns/swaedit/flags src/flags.xsd ">
	<flag>
	    <name>is_npc</name>
	    <value>1</value>
	</flag>
	<flag>
	    <name>sentinel</name>
	    <value>2</value>
	</flag>
	<flag>
	    <name>scavenger</name>
	    <value>4</value>
	</flag>
	<flag>
	    <name>aggressive</name>
	    <value>32</value>
	</flag>
	<flag>
	    <name>stay_area</name>
	    <value>64</value>
	</flag>
	<flag>
	    <name>wimpy</name>
	    <value>128</value>
	</flag>
	<flag>
	    <name>pet</name>
	    <value>256</value>
	</flag>
	<flag>
	    <name>train</name>
	    <value>512</value>
	</flag>
	<flag>
	    <name>practice</name>
	    <value>1024</value>
	</flag>
	<flag>
	    <name>immortal</name>
	    <value>2048</value>
	</flag>
	<flag>
	    <name>deadly</name>
	    <value>4096</value>
	</flag>
	<flag>
	    <name>polyself</name>
	    <value>8192</value>
	</flag>
	<flag>
	    <name>meta_aggr</name>
	    <value>16384</value>
	</flag>
	<flag>
	    <name>guardian</name>
	    <value>32768</value>
	</flag>
	<flag>
	    <name>running</name>
	    <value>65536</value>
	</flag>
	<flag>
	    <name>nowander</name>
	    <value>131072</value>
	</flag>
	<flag>
	    <name>mountable</name>
	    <value>262144</value>
	</flag>
	<flag>
	    <name>mounted</name>
	    <value>524288</value>
	</flag>
	<flag>
	    <name>scholar</name>
	    <value>1048576</value>
	</flag>
	<flag>
	    <name>secretive</name>
	    <value>2097152</value>
	</flag>
	<flag>
	    <name>polymorphed</name>
	    <value>4194304</value>
	</flag>
	<flag>
	    <name>mobinvis</name>
	    <value>8388608</value>
	</flag>
	<flag>
	    <name>noassist</name>
	    <value>16777216</value>
	</flag>
	<flag>
	    <name>nokill</name>
	    <value>33554432</value>
	</flag>
	<flag>
	    <name>droid</name>
	    <value>67108864</value>
	</flag>
	<flag>
	    <name>nocorpse</name>
	    <value>134217728</value>
	</flag>
	<flag>
	    <name>quest</name>
	    <value>268435456</value>
	</flag>
	<flag>
	    <name>prototype</name>
	    <value>1073741824</value>
	</flag>
</flags>
