<?xml version="1.0" encoding="UTF-8"?>
<flags xmlns="http://swmud.pl/ns/swaedit/flags"
	xmlns:xsi="http://www.w3.org/2001/XMLSchema-instance"
	xsi:schemaLocation="http://swmud.pl/ns/swaedit/flags src/flags.xsd ">
	<flag>
	    <name>dark</name>
	    <value>1</value>
	</flag>
	<flag>
	    <name>no_find</name>
	    <value>2</value>
	</flag>
	<flag>
	    <name>no_mob</name>
	    <value>4</value>
	</flag>
	<flag>
	    <name>indoors</name>
	    <value>8</value>
	</flag>
	<flag>
	    <name>can_land</name>
	    <value>16</value>
	</flag>
	<flag>
	    <name>can_fly</name>
	    <value>32</value>
	</flag>
	<flag>
	    <name>no_driving</name>
	    <value>64</value>
	</flag>
	<flag>
	    <name>no_force</name>
	    <value>128</value>
	</flag>
	<flag>
	    <name>bank</name>
	    <value>256</value>
	</flag>
	<flag>
	    <name>private</name>
	    <value>512</value>
	</flag>
	<flag>
	    <name>safe</name>
	    <value>1024</value>
	</flag>
	<flag>
	    <name>import</name>
	    <value>2048</value>
	</flag>
	<flag>
	    <name>pet_shop</name>
	    <value>4096</value>
	</flag>
	<flag>
	    <name>bacta</name>
	    <value>8192</value>
	</flag>
	<flag>
	    <name>donation</name>
	    <value>16384</value>
	</flag>
	<flag>
	    <name>nodropall</name>
	    <value>32768</value>
	</flag>
	<flag>
	    <name>silence</name>
	    <value>65536</value>
	</flag>
	<flag>
	    <name>logspeech</name>
	    <value>131072</value>
	</flag>
	<flag>
	    <name>nodrop</name>
	    <value>262144</value>
	</flag>
	<flag>
	    <name>stock_market</name>
	    <value>524288</value>
	</flag>
	<flag>
	    <name>plr_home</name>
	    <value>1048576</value>
	</flag>
	<flag>
	    <name>empty_home</name>
	    <value>2097152</value>
	</flag>
	<flag>
	    <name>teleport</name>
	    <value>4194304</value>
	</flag>
	<flag>
	    <name>hotel</name>
	    <value>8388608</value>
	</flag>
	<flag>
	    <name>nofloor</name>
	    <value>16777216</value>
	</flag>
	<flag>
	    <name>refinery</name>
	    <value>33554432</value>
	</flag>
	<flag>
	    <name>factory</name>
	    <value>67108864</value>
	</flag>
	<flag>
	    <name>killarena</name>
	    <value>134217728</value>
	</flag>
	<flag>
	    <name>safearena</name>
	    <value>268435456</value>
	</flag>
	<flag>
	    <name>spacecraft</name>
	    <value>536870912</value>
	</flag>
	<flag>
	    <name>prototype</name>
	    <value>1073741824</value>
	</flag>
	<flag>
	    <name>auction</name>
	    <value>2147483648</value>
	</flag>
</flags>
