<?xml version="1.0" encoding="ISO-8859-2"?>
<flags xmlns="http://swmud.pl/ns/swaedit/flags"
	xmlns:xsi="http://www.w3.org/2001/XMLSchema-instance"
	xsi:schemaLocation="http://swmud.pl/ns/swaedit/flags src/flags.xsd ">
	<flag>
	    <name>isdoor</name>
	    <value>1</value>
	</flag>
	<flag>
	    <name>closed</name>
	    <value>2</value>
	</flag>
	<flag>
	    <name>locked</name>
	    <value>4</value>
	</flag>
	<flag>
	    <name>secret</name>
	    <value>8</value>
	</flag>
	<flag>
	    <name>swim</name>
	    <value>16</value>
	</flag>
	<flag>
	    <name>pickproof</name>
	    <value>32</value>
	</flag>
	<flag>
	    <name>fly</name>
	    <value>64</value>
	</flag>
	<flag>
	    <name>climb</name>
	    <value>128</value>
	</flag>
	<flag>
	    <name>dig</name>
	    <value>256</value>
	</flag>
	<flag>
	    <name>res1</name>
	    <value>512</value>
	</flag>
	<flag>
	    <name>nopassdoor</name>
	    <value>1024</value>
	</flag>
	<flag>
	    <name>hidden</name>
	    <value>2048</value>
	</flag>
	<flag>
	    <name>passage</name>
	    <value>4096</value>
	</flag>
	<flag>
	    <name>portal</name>
	    <value>8192</value>
	</flag>
	<flag>
	    <name>res2</name>
	    <value>16384</value>
	</flag>
	<flag>
	    <name>res3</name>
	    <value>32768</value>
	</flag>
	<flag>
	    <name>xclimb</name>
	    <value>65536</value>
	</flag>
	<flag>
	    <name>xenter</name>
	    <value>131072</value>
	</flag>
	<flag>
	    <name>xleave</name>
	    <value>262144</value>
	</flag>
	<flag>
	    <name>xauto</name>
	    <value>524288</value>
	</flag>
	<flag>
	    <name>res4</name>
	    <value>1048576</value>
	</flag>
	<flag>
	    <name>xsearchable</name>
	    <value>2097152</value>
	</flag>
	<flag>
	    <name>bashed</name>
	    <value>4194304</value>
	</flag>
	<flag>
	    <name>bashproof</name>
	    <value>8388608</value>
	</flag>
	<flag>
	    <name>nomob</name>
	    <value>16777216</value>
	</flag>
	<flag>
	    <name>window</name>
	    <value>33554432</value>
	</flag>
	<flag>
	    <name>xlook</name>
	    <value>67108864</value>
	</flag>
</flags>
