<?xml version="1.0" encoding="ISO-8859-2"?>
<flags xmlns="http://swmud.pl/ns/swaedit/flags"
	xmlns:xsi="http://www.w3.org/2001/XMLSchema-instance"
	xsi:schemaLocation="http://swmud.pl/ns/swaedit/flags src/flags.xsd ">
	<flag>
		<name>glow</name>
		<value>1</value>
	</flag>
	<flag>
		<name>hum</name>
		<value>2</value>
	</flag>
	<flag>
		<name>quest</name>
		<value>4</value>
	</flag>
	<flag>
		<name>hutt_size</name>
		<value>8</value>
	</flag>
	<flag>
		<name>contraband</name>
		<value>16</value>
	</flag>
	<flag>
		<name>invis</name>
		<value>32</value>
	</flag>
	<flag>
		<name>force</name>
		<value>64</value>
	</flag>
	<flag>
		<name>nodrop</name>
		<value>128</value>
	</flag>
	<flag>
		<name>bless</name>
		<value>256</value>
	</flag>
	<flag>
		<name>anti_good</name>
		<value>512</value>
	</flag>
	<flag>
		<name>anti_evil</name>
		<value>1024</value>
	</flag>
	<flag>
		<name>anti_neutral</name>
		<value>2048</value>
	</flag>
	<flag>
		<name>noremove</name>
		<value>4096</value>
	</flag>
	<flag>
		<name>inventory</name>
		<value>8192</value>
	</flag>
	<flag>
		<name>anti_soldier</name>
		<value>16384</value>
	</flag>
	<flag>
		<name>anti_thief</name>
		<value>32768</value>
	</flag>
	<flag>
		<name>anti_hunter</name>
		<value>65536</value>
	</flag>
	<flag>
		<name>anti_jedi</name>
		<value>131072</value>
	</flag>
	<flag>
		<name>small_size</name>
		<value>262144</value>
	</flag>
	<flag>
		<name>large_size</name>
		<value>524288</value>
	</flag>
	<flag>
		<name>donation</name>
		<value>1048576</value>
	</flag>
	<flag>
		<name>clan_object</name>
		<value>2097152</value>
	</flag>
	<flag>
		<name>anti_citizen</name>
		<value>4194304</value>
	</flag>
	<flag>
		<name>anti_sith</name>
		<value>8388608</value>
	</flag>
	<flag>
		<name>anti_pilot</name>
		<value>16777216</value>
	</flag>
	<flag>
		<name>hidden</name>
		<value>33554432</value>
	</flag>
	<flag>
		<name>poisoned</name>
		<value>67108864</value>
	</flag>
	<flag>
		<name>covering</name>
		<value>134217728</value>
	</flag>
	<flag>
		<name>personal</name>
		<value>268435456</value>
	</flag>
	<flag>
		<name>burried</name>
		<value>536870912</value>
	</flag>
	<flag>
		<name>prototype</name>
		<value>1073741824</value>
	</flag>
	<flag>
		<name>human_size</name>
		<value>2147483648</value>
	</flag>
</flags>
