<?xml version="1.0" encoding="ISO-8859-2"?>
<flags xmlns="http://swmud.pl/ns/swaedit/flags"
	xmlns:xsi="http://www.w3.org/2001/XMLSchema-instance"
	xsi:schemaLocation="http://swmud.pl/ns/swaedit/flags src/flags.xsd ">
	<flag>
	    <name>blind</name>
	    <value>1</value>
	</flag>
	<flag>
	    <name>invisible</name>
	    <value>2</value>
	</flag>
	<flag>
	    <name>detect_evil</name>
	    <value>4</value>
	</flag>
	<flag>
	    <name>detect_invis</name>
	    <value>8</value>
	</flag>
	<flag>
	    <name>detect_force</name>
	    <value>16</value>
	</flag>
	<flag>
	    <name>detect_hidden</name>
	    <value>32</value>
	</flag>
	<flag>
	    <name>weaken</name>
	    <value>64</value>
	</flag>
	<flag>
	    <name>sanctuary</name>
	    <value>128</value>
	</flag>
	<flag>
	    <name>faerie_fire</name>
	    <value>256</value>
	</flag>
	<flag>
	    <name>infrared</name>
	    <value>512</value>
	</flag>
	<flag>
	    <name>curse</name>
	    <value>1024</value>
	</flag>
	<flag>
	    <name>dominated</name>
	    <value>2048</value>
	</flag>
	<flag>
	    <name>poison</name>
	    <value>4096</value>
	</flag>
	<flag>
	    <name>protect</name>
	    <value>8192</value>
	</flag>
	<flag>
	    <name>paralysis</name>
	    <value>16384</value>
	</flag>
	<flag>
	    <name>sneak</name>
	    <value>32768</value>
	</flag>
	<flag>
	    <name>hide</name>
	    <value>65536</value>
	</flag>
	<flag>
	    <name>sleep</name>
	    <value>131072</value>
	</flag>
	<flag>
	    <name>charm</name>
	    <value>262144</value>
	</flag>
	<flag>
	    <name>flying</name>
	    <value>524288</value>
	</flag>
	<flag>
	    <name>pass_door</name>
	    <value>1048576</value>
	</flag>
	<flag>
	    <name>floating</name>
	    <value>2097152</value>
	</flag>
	<flag>
	    <name>truesight</name>
	    <value>4194304</value>
	</flag>
	<flag>
	    <name>detecttraps</name>
	    <value>8388608</value>
	</flag>
	<flag>
	    <name>scrying</name>
	    <value>16777216</value>
	</flag>
	<flag>
	    <name>forceinvis</name>
	    <value>33554432</value>
	</flag>
	<flag>
	    <name>shockshield</name>
	    <value>67108864</value>
	</flag>
	<flag>
	    <name>disguise</name>
	    <value>134217728</value>
	</flag>
	<flag>
	    <name>iceshield</name>
	    <value>268435456</value>
	</flag>
	<flag>
	    <name>possess</name>
	    <value>536870912</value>
	</flag>
	<flag>
	    <name>berserk</name>
	    <value>1073741824</value>
	</flag>
	<flag>
	    <name>aqua_breath</name>
	    <value>2147483648</value>
	</flag>
</flags>
